{
  "schemaVersion": "1.0",
  "catalogVersion": "2026.1",
  "cloud": "GCP",
  "profiles": {
    "Inventory": "Collects configuration inventory without issuing most security conclusions.",
    "Assessment": "Default read-only posture assessment.",
    "Validation": "Adds non-destructive validation. Requires an authorized, in-window engagement.",
    "AdversarySimulation": "Requires explicit adversary-simulation approval; this framework remains read-only and does not execute exploitation."
  },
  "controls": [
    {
      "id": "CSAF-GCP-IAM-001",
      "title": "Service accounts do not hold owner/editor/admin roles",
      "category": "PrivilegedAccess",
      "module": "identity",
      "check": "sa_admin_roles",
      "defaultSeverity": "HIGH",
      "expectedState": "No project service account is bound to roles/owner, roles/editor, or an *Admin role.",
      "profiles": ["Assessment", "Validation", "AdversarySimulation"],
      "mappings": ["CIS-GCP:1.5", "MITRE:T1078.004", "NIST-800-53:AC-6"],
      "references": ["https://cloud.google.com/iam/docs/best-practices-service-accounts"]
    },
    {
      "id": "CSAF-GCP-IAM-002",
      "title": "Service accounts have no user-managed keys",
      "category": "Identity",
      "module": "identity",
      "check": "user_managed_sa_keys",
      "defaultSeverity": "MEDIUM",
      "expectedState": "Every service-account key is Google-managed; no user-managed keys exist.",
      "profiles": ["Assessment", "Validation", "AdversarySimulation"],
      "mappings": ["CIS-GCP:1.4", "MITRE:T1552.004"],
      "references": []
    },
    {
      "id": "CSAF-GCP-IAM-003",
      "title": "User-managed service-account keys are rotated",
      "category": "Identity",
      "module": "identity",
      "check": "sa_key_rotation",
      "defaultSeverity": "MEDIUM",
      "expectedState": "Any user-managed service-account key is younger than the rotation threshold (default 90 days).",
      "profiles": ["Assessment", "Validation", "AdversarySimulation"],
      "mappings": ["CIS-GCP:1.7", "NIST-800-53:IA-5"],
      "references": []
    },
    {
      "id": "CSAF-GCP-IAM-004",
      "title": "Basic owner/editor roles are not granted to users or groups",
      "category": "PrivilegedAccess",
      "module": "identity",
      "check": "basic_roles_on_users",
      "defaultSeverity": "MEDIUM",
      "expectedState": "User, group, and domain principals hold predefined or custom roles, not basic owner/editor roles.",
      "profiles": ["Assessment", "Validation", "AdversarySimulation"],
      "mappings": ["MITRE:T1078.004", "NIST-800-53:AC-6"],
      "references": []
    },
    {
      "id": "CSAF-GCP-LOG-001",
      "title": "Cloud audit logging covers all services and users",
      "category": "Logging",
      "module": "logging",
      "check": "audit_logging",
      "defaultSeverity": "MEDIUM",
      "expectedState": "The project audit configuration enables ADMIN_READ, DATA_READ, and DATA_WRITE for allServices with no exempted members.",
      "profiles": ["Assessment", "Validation", "AdversarySimulation"],
      "mappings": ["CIS-GCP:2.1", "NIST-800-53:AU-2"],
      "references": []
    },
    {
      "id": "CSAF-GCP-LOG-002",
      "title": "A catch-all log sink exports all log entries",
      "category": "Logging",
      "module": "logging",
      "check": "log_sinks",
      "defaultSeverity": "MEDIUM",
      "expectedState": "At least one enabled, unfiltered log sink exports every log entry from the project.",
      "profiles": ["Assessment", "Validation", "AdversarySimulation"],
      "mappings": ["CIS-GCP:2.2", "NIST-800-53:AU-9"],
      "references": []
    },
    {
      "id": "CSAF-GCP-STO-001",
      "title": "Buckets are not publicly accessible",
      "category": "DataProtection",
      "module": "storage",
      "check": "bucket_public_iam",
      "defaultSeverity": "CRITICAL",
      "expectedState": "No bucket IAM policy grants access to allUsers or allAuthenticatedUsers.",
      "profiles": ["Assessment", "Validation", "AdversarySimulation"],
      "mappings": ["CIS-GCP:5.1", "MITRE:T1530"],
      "references": []
    },
    {
      "id": "CSAF-GCP-STO-002",
      "title": "Buckets enforce uniform bucket-level access",
      "category": "DataProtection",
      "module": "storage",
      "check": "uniform_bucket_access",
      "defaultSeverity": "MEDIUM",
      "expectedState": "Every bucket enables uniform bucket-level access (no legacy per-object ACLs).",
      "profiles": ["Assessment", "Validation", "AdversarySimulation"],
      "mappings": ["CIS-GCP:5.2", "NIST-800-53:AC-3"],
      "references": []
    },
    {
      "id": "CSAF-GCP-NET-001",
      "title": "The auto-created default network does not exist",
      "category": "Network",
      "module": "network",
      "check": "default_network",
      "defaultSeverity": "MEDIUM",
      "expectedState": "The project does not contain the auto-created 'default' VPC network.",
      "profiles": ["Assessment", "Validation", "AdversarySimulation"],
      "mappings": ["CIS-GCP:3.1", "MITRE:T1133"],
      "references": []
    },
    {
      "id": "CSAF-GCP-NET-002",
      "title": "Firewall rules do not allow 0.0.0.0/0 ingress to admin ports",
      "category": "Network",
      "module": "network",
      "check": "open_admin_ports",
      "defaultSeverity": "HIGH",
      "expectedState": "No enabled ingress firewall rule allows 0.0.0.0/0 to ports 22 or 3389.",
      "profiles": ["Assessment", "Validation", "AdversarySimulation"],
      "mappings": ["CIS-GCP:3.6", "CIS-GCP:3.7", "MITRE:T1133"],
      "references": []
    },
    {
      "id": "CSAF-GCP-NET-003",
      "title": "VPC subnetworks enable flow logs",
      "category": "Network",
      "module": "network",
      "check": "subnet_flow_logs",
      "defaultSeverity": "MEDIUM",
      "expectedState": "Every standard VPC subnetwork has flow logs enabled.",
      "profiles": ["Assessment", "Validation", "AdversarySimulation"],
      "mappings": ["CIS-GCP:3.8", "NIST-800-53:AU-12"],
      "references": []
    },
    {
      "id": "CSAF-GCP-VM-001",
      "title": "Instances do not run as the default compute service account",
      "category": "Compute",
      "module": "compute",
      "check": "default_service_account",
      "defaultSeverity": "MEDIUM",
      "expectedState": "No non-GKE instance uses the default Compute Engine service account.",
      "profiles": ["Assessment", "Validation", "AdversarySimulation"],
      "mappings": ["CIS-GCP:4.1", "MITRE:T1078.004"],
      "references": []
    },
    {
      "id": "CSAF-GCP-VM-002",
      "title": "Instances do not have external IP addresses",
      "category": "Compute",
      "module": "compute",
      "check": "public_ip_instances",
      "defaultSeverity": "MEDIUM",
      "expectedState": "Compute instances have no external (NAT) IP addresses.",
      "profiles": ["Assessment", "Validation", "AdversarySimulation"],
      "mappings": ["CIS-GCP:4.9", "MITRE:T1133"],
      "references": []
    },
    {
      "id": "CSAF-GCP-VM-003",
      "title": "OS Login is enabled at the project level",
      "category": "Compute",
      "module": "compute",
      "check": "os_login",
      "defaultSeverity": "MEDIUM",
      "expectedState": "Project metadata sets enable-oslogin=TRUE and no instance overrides it to false.",
      "profiles": ["Assessment", "Validation", "AdversarySimulation"],
      "mappings": ["CIS-GCP:4.4", "NIST-800-53:IA-2"],
      "references": []
    },
    {
      "id": "CSAF-GCP-VM-004",
      "title": "Interactive serial-port access is disabled",
      "category": "Compute",
      "module": "compute",
      "check": "serial_ports_disabled",
      "defaultSeverity": "MEDIUM",
      "expectedState": "No instance sets serial-port-enable to true.",
      "profiles": ["Assessment", "Validation", "AdversarySimulation"],
      "mappings": ["CIS-GCP:4.5", "MITRE:T1021"],
      "references": []
    },
    {
      "id": "CSAF-GCP-KMS-001",
      "title": "Symmetric CMEK keys rotate within the threshold",
      "category": "DataProtection",
      "module": "kms",
      "check": "kms_key_rotation",
      "defaultSeverity": "MEDIUM",
      "expectedState": "Every enabled symmetric Cloud KMS key has a rotation period no longer than the baseline threshold (default 90 days).",
      "profiles": ["Assessment", "Validation", "AdversarySimulation"],
      "mappings": ["CIS-GCP:1.10", "NIST-800-53:SC-12"],
      "references": []
    },
    {
      "id": "CSAF-GCP-SQL-001",
      "title": "Cloud SQL instances are not open to the world",
      "category": "DataProtection",
      "module": "sql",
      "check": "sql_open_to_world",
      "defaultSeverity": "HIGH",
      "expectedState": "No Cloud SQL instance authorizes 0.0.0.0/0 as a client network.",
      "profiles": ["Assessment", "Validation", "AdversarySimulation"],
      "mappings": ["CIS-GCP:6.5", "MITRE:T1530"],
      "references": []
    },
    {
      "id": "CSAF-GCP-SQL-002",
      "title": "Cloud SQL instances require TLS connections",
      "category": "DataProtection",
      "module": "sql",
      "check": "sql_require_ssl",
      "defaultSeverity": "MEDIUM",
      "expectedState": "Every public-IP Cloud SQL instance requires TLS for client connections.",
      "profiles": ["Assessment", "Validation", "AdversarySimulation"],
      "mappings": ["CIS-GCP:6.4", "NIST-800-53:SC-8"],
      "references": []
    },
    {
      "id": "CSAF-GCP-OPS-001",
      "title": "Project break-glass procedure is documented",
      "category": "Operations",
      "module": "attestation",
      "check": "attestation",
      "defaultSeverity": "MEDIUM",
      "expectedState": "A documented, tested break-glass procedure exists for organization and project owner access.",
      "profiles": ["Assessment", "Validation", "AdversarySimulation"],
      "mappings": ["NIST-800-53:CP-2"],
      "references": []
    }
  ]
}
