{
  "schemaVersion": "1.0",
  "catalogVersion": "2026.1",
  "cloud": "Azure",
  "profiles": {
    "Inventory": "Collects configuration inventory without issuing most security conclusions.",
    "Assessment": "Default read-only posture assessment.",
    "Validation": "Adds non-destructive validation. Requires an authorized, in-window engagement.",
    "AdversarySimulation": "Requires explicit adversary-simulation approval; this framework remains read-only and does not execute exploitation."
  },
  "controls": [
    {
      "id": "CSAF-AZ-IAM-001",
      "title": "No custom subscription-administrator roles exist",
      "category": "PrivilegedAccess",
      "module": "identity",
      "check": "custom_owner_roles",
      "defaultSeverity": "HIGH",
      "expectedState": "No custom RBAC role grants Actions:* at subscription or root scope.",
      "profiles": ["Assessment", "Validation", "AdversarySimulation"],
      "mappings": ["CIS-Azure:1.23", "MITRE:T1078.004", "NIST-800-53:AC-6"],
      "references": ["https://learn.microsoft.com/azure/role-based-access-control/custom-roles"]
    },
    {
      "id": "CSAF-AZ-IAM-002",
      "title": "Subscription Owner assignments are limited",
      "category": "PrivilegedAccess",
      "module": "identity",
      "check": "subscription_owner_count",
      "defaultSeverity": "MEDIUM",
      "expectedState": "No more than the baseline threshold of Owner role assignments exist at subscription scope.",
      "profiles": ["Assessment", "Validation", "AdversarySimulation"],
      "mappings": ["MITRE:T1078.004", "NIST-800-53:AC-6(5)"],
      "references": []
    },
    {
      "id": "CSAF-AZ-DEF-001",
      "title": "Microsoft Defender for Cloud plans cover core workloads",
      "category": "Detection",
      "module": "defender",
      "check": "defender_plans",
      "defaultSeverity": "MEDIUM",
      "expectedState": "Defender plans for servers, storage, and SQL are on the Standard tier.",
      "profiles": ["Assessment", "Validation", "AdversarySimulation"],
      "mappings": ["CIS-Azure:2.1", "NIST-800-53:SI-4", "MITRE:DS0015"],
      "references": ["https://learn.microsoft.com/azure/defender-for-cloud/enable-enhanced-security"]
    },
    {
      "id": "CSAF-AZ-DEF-002",
      "title": "A Defender for Cloud security contact is configured",
      "category": "Detection",
      "module": "defender",
      "check": "security_contact",
      "defaultSeverity": "LOW",
      "expectedState": "A security contact email address is configured for the subscription.",
      "profiles": ["Assessment", "Validation", "AdversarySimulation"],
      "mappings": ["CIS-Azure:2.1.18", "NIST-800-53:IR-6"],
      "references": []
    },
    {
      "id": "CSAF-AZ-STO-001",
      "title": "Storage accounts require secure transfer",
      "category": "DataProtection",
      "module": "storage",
      "check": "secure_transfer",
      "defaultSeverity": "MEDIUM",
      "expectedState": "Every storage account sets supportsHttpsTrafficOnly to true.",
      "profiles": ["Assessment", "Validation", "AdversarySimulation"],
      "mappings": ["CIS-Azure:3.1", "NIST-800-53:SC-8"],
      "references": []
    },
    {
      "id": "CSAF-AZ-STO-002",
      "title": "Storage accounts disallow blob public access",
      "category": "DataProtection",
      "module": "storage",
      "check": "blob_public_access",
      "defaultSeverity": "HIGH",
      "expectedState": "Every storage account sets allowBlobPublicAccess to false.",
      "profiles": ["Assessment", "Validation", "AdversarySimulation"],
      "mappings": ["CIS-Azure:3.7", "MITRE:T1530"],
      "references": []
    },
    {
      "id": "CSAF-AZ-STO-003",
      "title": "Storage accounts enforce TLS 1.2 or higher",
      "category": "DataProtection",
      "module": "storage",
      "check": "minimum_tls",
      "defaultSeverity": "MEDIUM",
      "expectedState": "Every storage account sets minimumTlsVersion to TLS1_2 or newer.",
      "profiles": ["Assessment", "Validation", "AdversarySimulation"],
      "mappings": ["CIS-Azure:3.15", "NIST-800-53:SC-8"],
      "references": []
    },
    {
      "id": "CSAF-AZ-STO-004",
      "title": "Storage account network access defaults to deny",
      "category": "DataProtection",
      "module": "storage",
      "check": "default_network_deny",
      "defaultSeverity": "MEDIUM",
      "expectedState": "Every storage account's network ACL default action is Deny.",
      "profiles": ["Assessment", "Validation", "AdversarySimulation"],
      "mappings": ["CIS-Azure:3.8", "MITRE:T1530"],
      "references": []
    },
    {
      "id": "CSAF-AZ-NET-001",
      "title": "NSGs do not allow internet ingress to admin ports",
      "category": "Network",
      "module": "network",
      "check": "nsg_admin_ingress",
      "defaultSeverity": "HIGH",
      "expectedState": "No network security group allows inbound Internet/any traffic to ports 22 or 3389.",
      "profiles": ["Assessment", "Validation", "AdversarySimulation"],
      "mappings": ["CIS-Azure:6.1", "CIS-Azure:6.2", "MITRE:T1133"],
      "references": []
    },
    {
      "id": "CSAF-AZ-NET-002",
      "title": "Network Watcher is enabled in used locations",
      "category": "Network",
      "module": "network",
      "check": "network_watcher",
      "defaultSeverity": "LOW",
      "expectedState": "Network Watcher is provisioned in every location that hosts a virtual network.",
      "profiles": ["Assessment", "Validation", "AdversarySimulation"],
      "mappings": ["CIS-Azure:6.5", "NIST-800-53:AU-12"],
      "references": []
    },
    {
      "id": "CSAF-AZ-VM-001",
      "title": "Virtual machines use managed disks",
      "category": "Compute",
      "module": "compute",
      "check": "vm_managed_disks",
      "defaultSeverity": "MEDIUM",
      "expectedState": "Every VM's OS and data disks are managed disks (no legacy VHD blobs).",
      "profiles": ["Assessment", "Validation", "AdversarySimulation"],
      "mappings": ["CIS-Azure:7.2", "NIST-800-53:SC-28"],
      "references": []
    },
    {
      "id": "CSAF-AZ-LOG-001",
      "title": "The subscription activity log is exported",
      "category": "Logging",
      "module": "monitor",
      "check": "activity_log_export",
      "defaultSeverity": "MEDIUM",
      "expectedState": "A diagnostic setting exports Administrative, Security, Policy, and Alert activity-log categories.",
      "profiles": ["Assessment", "Validation", "AdversarySimulation"],
      "mappings": ["CIS-Azure:5.1.1", "NIST-800-53:AU-2"],
      "references": []
    },
    {
      "id": "CSAF-AZ-SQL-001",
      "title": "Azure SQL server auditing is enabled",
      "category": "Logging",
      "module": "sql",
      "check": "sql_auditing",
      "defaultSeverity": "MEDIUM",
      "expectedState": "Every Azure SQL server has auditing set to Enabled.",
      "profiles": ["Assessment", "Validation", "AdversarySimulation"],
      "mappings": ["CIS-Azure:4.1.1", "NIST-800-53:AU-2"],
      "references": []
    },
    {
      "id": "CSAF-AZ-SQL-002",
      "title": "Azure SQL servers block public network access",
      "category": "DataProtection",
      "module": "sql",
      "check": "sql_public_network_access",
      "defaultSeverity": "HIGH",
      "expectedState": "Every Azure SQL server sets publicNetworkAccess to Disabled.",
      "profiles": ["Assessment", "Validation", "AdversarySimulation"],
      "mappings": ["CIS-Azure:4.1.2", "MITRE:T1530"],
      "references": []
    },
    {
      "id": "CSAF-AZ-KV-001",
      "title": "Key vaults are recoverable (soft delete and purge protection)",
      "category": "DataProtection",
      "module": "keyvault",
      "check": "purge_protection",
      "defaultSeverity": "MEDIUM",
      "expectedState": "Every key vault enables soft delete and purge protection.",
      "profiles": ["Assessment", "Validation", "AdversarySimulation"],
      "mappings": ["CIS-Azure:8.4", "NIST-800-53:CP-9"],
      "references": ["https://learn.microsoft.com/azure/key-vault/general/soft-delete-overview"]
    },
    {
      "id": "CSAF-AZ-SEC-001",
      "title": "Potential Azure secret-bearing resource locations are inventoried",
      "category": "Secrets",
      "module": "secret_discovery",
      "check": "secret_bearing_locations",
      "defaultSeverity": "LOW",
      "expectedState": "Potential secret-bearing locations are inventoried under explicit authorization; secret values are never retrieved or persisted.",
      "profiles": ["Validation"],
      "validationOnly": true,
      "mappings": ["NIST-800-53:CM-8"],
      "references": ["https://trustedsec.com/blog/the-art-of-hunting-azure-cloud-secrets"]
    },
    {
      "id": "CSAF-AZ-OPS-001",
      "title": "Subscription break-glass procedure is documented",
      "category": "Operations",
      "module": "attestation",
      "check": "attestation",
      "defaultSeverity": "MEDIUM",
      "expectedState": "A documented, tested break-glass procedure exists for Global Administrator and subscription Owner access.",
      "profiles": ["Assessment", "Validation", "AdversarySimulation"],
      "mappings": ["NIST-800-53:CP-2"],
      "references": []
    }
  ]
}
